{
  "artifact_type": "studio_intake_packet",
  "packet_id": "studio-review-target-boundary-001",
  "created_at": "2026-03-14T12:05:00Z",
  "source_mode": "maya_council",
  "participants": [
    "maya:moderator",
    "maya:distillator",
    "provider:claude_sonnet"
  ],
  "topic": "whether Studio intake packets need one extra bounded readability hint for local review without implying a stronger destination",
  "proposal_type": "design_direction",
  "claim_status": "bounded_proposal",
  "evidence_status": "example_supported",
  "challenge_status": "challenged_with_open_conflicts",
  "drift_risk": "medium",
  "recommendation_scope": "review_later",
  "promotion_state": "proposal_only",
  "distilled_summary": "the issue is still a bounded packet-shape design question inside the local review layer and should stay in manual design follow-up rather than escalate to a later human decision target",
  "open_conflicts": [
    "some readers want one extra readability hint while others want to keep packet shape thinner to avoid pseudo-runtime drift"
  ],
  "next_review_target": "manual_design_followup",
  "source_refs": [
    "AICOS_STUDIO_INTAKE_PACKET_SPEC.md#purpose",
    "AICOS_STUDIO_REVIEW_TARGET_MAPPING.md#design_direction"
  ],
  "distillator_notes": "Do not treat clearer packet wording as a reason for human escalation."
}
