{
  "artifact_type": "studio_intake_packet",
  "packet_id": "studio-packet-002",
  "created_at": "2026-03-13T18:20:00Z",
  "source_mode": "multi_provider_debate",
  "participants": [
    "maya:moderator",
    "maya:distillator",
    "provider:claude_sonnet",
    "provider:gemini_flash",
    "human:operator"
  ],
  "topic": "whether an existing registry card should receive a later manual clarity review because studio debate found ambiguous scope language",
  "proposal_type": "review_target_candidate",
  "claim_status": "bounded_proposal",
  "evidence_status": "cross_reference_supported",
  "challenge_status": "challenge_passed_for_proposal_use",
  "drift_risk": "low",
  "recommendation_scope": "request_human_decision",
  "promotion_state": "not_promoted",
  "distilled_summary": "the discussion does not propose a direct registry change but does justify a later human registry review focused on scope clarity and wording discipline for one already-existing card",
  "open_conflicts": [
    "participants disagree on whether the ambiguity is substantial enough to justify review priority now or should wait for a larger content pass"
  ],
  "next_review_target": "human_registry_review",
  "source_refs": [
    "AICOS_STUDIO_EXAMPLE_PACKETS.md#example-2"
  ],
  "distillator_notes": "This remains a nomination for later human review only."
}
