{
  "artifact_type": "studio_intake_packet",
  "packet_id": "studio-review-target-boundary-003",
  "created_at": "2026-03-14T12:14:00Z",
  "source_mode": "expert_challenge_round",
  "participants": [
    "maya:moderator",
    "provider:gpt_reasoner",
    "human:operator"
  ],
  "topic": "whether a conflict-bearing review packet may be carried into a later human-owned decision context without overstating approval or registry readiness",
  "proposal_type": "challenge_dossier_seed",
  "claim_status": "bounded_proposal",
  "evidence_status": "needs_evidence",
  "challenge_status": "challenged_with_open_conflicts",
  "drift_risk": "medium",
  "recommendation_scope": "request_human_decision",
  "promotion_state": "not_promoted",
  "distilled_summary": "the packet has crossed out of mere design hygiene because a real carry-forward choice must be made, but it still does not justify human registry review",
  "open_conflicts": [
    "participants disagree on whether the unresolved conflict should remain held locally or be exposed to a later bounded human decision posture"
  ],
  "next_review_target": "request_human_decision",
  "source_refs": [
    "AICOS_STUDIO_REVIEW_PROCEDURE.md#when-user-gate-is-mandatory",
    "AICOS_STUDIO_REVIEW_TARGET_MAPPING.md#review_target_candidate"
  ],
  "distillator_notes": "Escalate only to bounded human decision context; do not reframe this as registry review."
}
