{
  "artifact_type": "studio_intake_packet",
  "packet_id": "studio-review-target-boundary-004",
  "created_at": "2026-03-14T12:18:00Z",
  "source_mode": "multi_provider_debate",
  "participants": [
    "maya:moderator",
    "maya:distillator",
    "provider:claude_sonnet",
    "provider:gemini_flash",
    "human:operator"
  ],
  "topic": "whether one already-existing registry card boundary has enough bounded evidence and visible conflict to deserve later human registry wording review",
  "proposal_type": "card_review",
  "claim_status": "bounded_proposal",
  "evidence_status": "cross_reference_supported",
  "challenge_status": "challenge_passed_for_proposal_use",
  "drift_risk": "low",
  "recommendation_scope": "request_human_decision",
  "promotion_state": "not_promoted",
  "distilled_summary": "the packet stays proposal-only, but the case is specific enough and evidence-supported enough to justify later human registry review of one existing card boundary",
  "open_conflicts": [
    "participants still disagree on whether the wording defect is urgent now or should wait for a broader maintenance pass"
  ],
  "next_review_target": "human_registry_review",
  "source_refs": [
    "AICOS_STUDIO_REVIEW_TARGET_MAPPING.md#card_review",
    "AICOS_STUDIO_PIPELINE_SCENARIOS.md#scenario-4-review-to-bundle-flow"
  ],
  "distillator_notes": "Nomination only; no registry mutation is implied here."
}
