{
  "artifact_type": "studio_intake_packet",
  "packet_id": "studio-review-target-boundary-006",
  "created_at": "2026-03-14T12:28:00Z",
  "source_mode": "multi_provider_debate",
  "participants": [
    "maya:moderator",
    "maya:distillator",
    "provider:claude_sonnet",
    "provider:gpt_reasoner",
    "human:operator"
  ],
  "topic": "whether an existing card boundary concern is ready for later human registry review or still needs an explicit bounded human decision on seriousness first",
  "proposal_type": "review_target_candidate",
  "claim_status": "bounded_proposal",
  "evidence_status": "example_supported",
  "challenge_status": "challenged_with_open_conflicts",
  "drift_risk": "medium",
  "recommendation_scope": "request_human_decision",
  "promotion_state": "not_promoted",
  "distilled_summary": "an existing card boundary is implicated, which makes human registry review plausible, but the current evidence and conflict posture are still too mixed to skip the bounded human decision step",
  "open_conflicts": [
    "participants disagree on whether the observed ambiguity is already a concrete registry wording problem or still a debate about seriousness and timing"
  ],
  "next_review_target": "request_human_decision",
  "source_refs": [
    "AICOS_STUDIO_REVIEW_TARGET_MAPPING.md#review_target_candidate",
    "AICOS_STUDIO_REVIEW_PROCEDURE.md#when-evidence-gate-is-mandatory"
  ],
  "distillator_notes": "This is the tightest escalation boundary in the corpus."
}
